{
  "$schema": "https://json-schema.org/draft/2020-12/schema",
  "$id": "https://datamodels.jp/schema/transportation/RoadRestriction/v1.0.0.json",
  "title": "RoadRestriction",
  "description": "One road restriction, including closures: road name, regulated section as a point, line or area, status and category.",
  "x-version": "1.0.0",
  "x-license-url": "https://datamodels.jp/LICENSE-CONTENT",
  "x-model-tags": "road, transportation, Japan",
  "type": "object",
  "properties": {
    "id": {
      "type": "string",
      "format": "uri",
      "description": "Entity id (URN)"
    },
    "type": {
      "type": "string",
      "const": "RoadRestriction",
      "description": "Entity type"
    },
    "@context": {
      "description": "JSON-LD context of the entity, optional: a context URL or a list of context URLs",
      "oneOf": [
        {
          "type": "string",
          "format": "uri"
        },
        {
          "type": "array",
          "items": {
            "type": "string",
            "format": "uri"
          },
          "minItems": 1
        }
      ]
    },
    "roadName": {
      "description": "Road name",
      "type": "string",
      "x-ngsi": {
        "type": "Property"
      },
      "x-iri": "https://smartdatamodels.org/dataModel.Transportation/roadName"
    },
    "roadType": {
      "description": "Road class by the Road Act (道路法第3条): expressway (高速自動車国道), nationalRoad (一般国道), prefecturalRoad (都道府県道), municipalRoad (市町村道), or other for a road outside the Act (農道, 林道, private road). A motorway designation (自動車専用道路) is not a class of its own: give the class of the road it is on",
      "type": "string",
      "enum": [
        "expressway",
        "nationalRoad",
        "prefecturalRoad",
        "municipalRoad",
        "other"
      ],
      "x-ngsi": {
        "type": "Property"
      },
      "x-iri": "https://datamodels.jp/ns/transportation/roadType"
    },
    "address": {
      "$ref": "https://datamodels.jp/schema/common/JapaneseAddress/v1.0.0.json",
      "description": "Address of the location, as a JapaneseAddress value (common subject)",
      "x-ngsi": {
        "type": "Property",
        "model": "https://datamodels.jp/ns/common/JapaneseAddress"
      },
      "x-iri": "https://schema.org/address"
    },
    "location": {
      "$ref": "https://datamodels.jp/schema/common/Geometry/v1.0.0.json",
      "description": "The regulated section, as a GeoJSON geometry. A point for a single-spot restriction, a LineString for a section, a polygon for an area, matching the point/line/area regulation forms (点規制・線規制・面規制) of the NPA's traffic regulation data format (交通規制情報（拡張版標準フォーマット）説明書 Ver: k_2.1, JARTIC, 2025-01-20)",
      "x-ngsi": {
        "type": "GeoProperty",
        "model": "https://datamodels.jp/ns/common/Geometry"
      },
      "x-iri": "https://uri.etsi.org/ngsi-ld/location"
    },
    "restrictionLength": {
      "type": "number",
      "minimum": 0,
      "description": "Length of the regulated section in metres, for a line. The NPA format (距離・延長, item 133) and EEI (距離・延長) carry it; the geometry alone may be simplified",
      "x-ngsi": {
        "type": "Property"
      },
      "x-iri": "https://datamodels.jp/ns/transportation/restrictionLength"
    },
    "maximumAllowedWeight": {
      "type": "number",
      "minimum": 0,
      "description": "Weight limit in kilograms: vehicles heavier than this may not pass (for example 4000 when the source limit is 4 t). The same term as Smart Data Models RoadSegment; the NPA format gives it in tonnes (制限重量, item 135). Whether it is gross weight or payload follows the source; keep its wording in statusLabel",
      "x-ngsi": {
        "type": "Property"
      },
      "x-iri": "https://smartdatamodels.org/dataModel.Transportation/maximumAllowedWeight"
    },
    "restrictionStatus": {
      "description": "Normalised restriction state, the value space of Smart Data Models RoadSegment.status: closed (no traffic), limited (traffic possible but not in full capacity), open (restriction lifted or not yet in place). The local wording goes in statusLabel; regulationCategory gives the finer public-sector category. When no value fits, leave it out and give the local wording in statusLabel",
      "type": "string",
      "enum": [
        "closed",
        "limited",
        "open"
      ],
      "x-ngsi": {
        "type": "Property"
      },
      "x-iri": "https://datamodels.jp/ns/transportation/restrictionStatus"
    },
    "regulationCategory": {
      "description": "Regulation category, from the legend of MLIT's Road Information Provision System (道路情報提供システム 通行規制情報, road-info-prvs.mlit.go.jp, accessed 2026-09-24): the categories a road administrator uses for a driver-facing closure or restriction. closedWeather (通行止(異常気象等)) also covers closures after a disaster, such as a landslide or a collapsed road shoulder. Optional and independent of restrictionStatus",
      "type": "string",
      "enum": [
        "closedWeather",
        "closedConstruction",
        "closedHeavyVehicle",
        "closedWinter",
        "laneRestriction",
        "alternatingOneWay",
        "mobileRestriction",
        "chainRestriction",
        "chainGuidance",
        "other"
      ],
      "x-ngsi": {
        "type": "Property"
      },
      "x-iri": "https://datamodels.jp/ns/transportation/regulationCategory"
    },
    "statusLabel": {
      "type": "string",
      "minLength": 1,
      "description": "The restriction status in the local or source system's wording (依頼中, 通行止め中, 解除済み). Required when restrictionStatus is left out",
      "x-ngsi": {
        "type": "Property"
      },
      "x-iri": "https://datamodels.jp/ns/task/statusLabel"
    },
    "validFrom": {
      "description": "When the restriction takes effect",
      "type": "string",
      "format": "date-time",
      "x-ngsi": {
        "type": "Property"
      },
      "x-iri": "https://smartdatamodels.org/validFrom"
    },
    "validTo": {
      "description": "When the restriction is lifted",
      "type": "string",
      "format": "date-time",
      "x-ngsi": {
        "type": "Property"
      },
      "x-iri": "https://smartdatamodels.org/dataModel.Alert/validTo"
    },
    "description": {
      "type": "string",
      "description": "Free-text memo",
      "x-ngsi": {
        "type": "Property"
      },
      "x-iri": "http://purl.org/dc/terms/description"
    }
  },
  "required": [
    "id",
    "type",
    "location"
  ],
  "anyOf": [
    {
      "required": [
        "restrictionStatus"
      ]
    },
    {
      "required": [
        "statusLabel"
      ]
    }
  ],
  "additionalProperties": false
}
