{
  "id": "urn:ngsi-ld:RoadRestriction:0001",
  "type": "RoadRestriction",
  "roadName": "靖国通り",
  "address": {
    "addressRegion": "東京都",
    "addressLocality": "千代田区",
    "machiaza": "九段南",
    "chome": "1",
    "jisMunicipalityCode": "13101",
    "addressText": "東京都千代田区九段南1丁目"
  },
  "location": {
    "type": "LineString",
    "coordinates": [
      [
        139.7505,
        35.695
      ],
      [
        139.752,
        35.6956
      ]
    ]
  },
  "restrictionLength": 150,
  "restrictionStatus": "closed",
  "regulationCategory": "closedWeather",
  "statusLabel": "通行止め中",
  "validFrom": "2026-07-08T10:45:00+09:00",
  "description": "アンダーパス冠水のため通行止め"
}
